{
  "schemaVersion": "deterministic-validation.v1",
  "authority": "DETERMINISTIC_VALIDATOR",
  "generatedAt": "2026-08-30T15:21:46.112Z",
  "artifactType": "FIELD_OVERVIEW_VIDEO",
  "fieldId": "0311",
  "status": "FAIL",
  "productionEligible": false,
  "checks": {
    "policyBinding": "PASS",
    "fieldId": "PASS",
    "artifactType": "PASS",
    "requiredFiles": "PASS",
    "evidenceFields": "PASS",
    "forbiddenStatus": "PASS",
    "sensitiveContent": "PASS",
    "structuralShape": "FAIL"
  },
  "errors": [
    "deterministic check failed: structuralShape"
  ],
  "semanticReviewRequired": true,
  "note": "Deterministic validation does not judge Aha, discovery, depth, naturalness, specificity, or mental-model usefulness."
}
